{
  "$schema": "schemas/mcp-host-observations.v1.schema.json",
  "schema_version": 1,
  "register_version": "2026-08-18",
  "claim_rule": "Each observation applies only to its exact host layers, execution mode, platform, provider, toolkit context, checks, and limitations. A version change neither proves incompatibility nor inherits prior runtime evidence; stable host support remains behavior-gated.",
  "observations": [
    {
      "id": "codex-cli-20260813",
      "host_id": "codex",
      "execution_mode": "standalone_cli",
      "recorded_at": "2026-08-13T14:06:42.897794+00:00",
      "executed_at": "2026-08-13T14:06:42.897794+00:00",
      "platform": {
        "os": "macos",
        "os_version": null,
        "os_build": null,
        "architecture": "arm64"
      },
      "host_layers": [
        {
          "role": "standalone_engine",
          "name": "Codex CLI",
          "version": "0.145.0",
          "sha256": null
        }
      ],
      "provider": {
        "name": "Engram",
        "version": "1.20.0",
        "sha256": null
      },
      "toolkit": {
        "version": null,
        "source_commit_context": null,
        "source_tree_context": null,
        "installed_wrapper_sha256": null
      },
      "project_resolution": {
        "expected_project": "example-product",
        "returned_project": "example-product",
        "provider_source": "not_retained",
        "project_path_state": "not_retained",
        "incoming_project_signal": "not_retained",
        "workspace_signal": "not_retained",
        "wrapper_resolution_source": "not_retained",
        "workspace_kind": "synthetic_git_repository"
      },
      "checks": {
        "host_connected_mcp_server": "passed",
        "mem_current_project": "passed",
        "registered_canonical_project": "passed",
        "workspace_signal_provenance": "not_retained",
        "wrapper_resolution_provenance": "not_retained",
        "memory_read": "not_performed",
        "memory_save": "not_performed",
        "unregistered_project": "not_run",
        "remote_mismatch": "not_run",
        "provider_unavailable": "not_run",
        "several_projects_isolated": "not_run",
        "clean_profile_isolation": "failed",
        "credential_isolation": "not_retained",
        "restart_persistence": "not_retained"
      },
      "clean_quit": {
        "runtime_processes": {
          "status": "not_retained",
          "method": "The historical receipt did not retain a post-quit runtime-process probe.",
          "observed_count": null
        },
        "database_holders": {
          "status": "not_retained",
          "method": "The historical receipt did not retain a post-quit database-holder probe.",
          "observed_count": null
        },
        "client_leases": {
          "status": "not_retained",
          "method": "The historical receipt did not retain a post-quit client-lease probe.",
          "observed_count": null
        }
      },
      "runtime_support_claim": false,
      "disposition": "partial_real_host_evidence_not_promoted",
      "limitations": [
        "Only the registered-project case ran through the named standalone host; the remaining real-host negative cases are still required.",
        "The process was ephemeral and read-only, but used the operator's existing Codex authentication.",
        "The historical evidence does not certify the Codex desktop application, IDE shell, another operating system, or another version.",
        "The historical receipt did not retain a dynamic repository-context contract."
      ],
      "source_refs": [
        {
          "repository_path": "docs/evidence/codex-0.145.0-darwin-arm64.json",
          "sha256": "c73cc00f02f633989a80179019d05d9211c3bf1481fe78ca793853770bd4dbf8"
        }
      ]
    },
    {
      "id": "codex-cli-0-145-0-dynamic-workspace-20260818",
      "host_id": "codex",
      "execution_mode": "standalone_cli",
      "recorded_at": "2026-08-17T23:36:11+00:00",
      "executed_at": "2026-08-17T23:31:20+00:00",
      "platform": {
        "os": "macos",
        "os_version": "26.6.1",
        "os_build": "25G76",
        "architecture": "arm64"
      },
      "host_layers": [
        {
          "role": "standalone_engine",
          "name": "Codex CLI",
          "version": "0.145.0",
          "sha256": "1da3f4e0e96028b8a771814293c3033dafd1971f943f6c7e79b0897fe705f590"
        }
      ],
      "provider": {
        "name": "Engram",
        "version": "1.20.0",
        "sha256": "cbcb115278c332313d35c1500d261eadfc9ff74d400b021f06b3362b1df2d80a"
      },
      "toolkit": {
        "version": "0.1.0",
        "source_commit_context": "0b12e42019218694fa792490f33525e497b26822",
        "source_tree_context": "d77abf9a67beb850be22e49f35903bebd6df0394",
        "installed_wrapper_sha256": "d4c9b67e21bf64b70c39efc74eda6e5de86ff5371d522d9cc272673627797bf4"
      },
      "project_resolution": {
        "expected_project": "naos-engram-memories",
        "returned_project": "naos-engram-memories",
        "provider_source": "process_override",
        "project_path_state": "empty",
        "incoming_project_signal": "absent",
        "workspace_signal": "process_cwd",
        "wrapper_resolution_source": "approved_git_remote",
        "workspace_kind": "synthetic_git_repository"
      },
      "checks": {
        "host_connected_mcp_server": "passed",
        "mem_current_project": "passed",
        "registered_canonical_project": "passed",
        "workspace_signal_provenance": "passed",
        "wrapper_resolution_provenance": "passed",
        "memory_read": "not_performed",
        "memory_save": "not_performed",
        "unregistered_project": "not_run",
        "remote_mismatch": "not_run",
        "provider_unavailable": "not_run",
        "several_projects_isolated": "not_run",
        "clean_profile_isolation": "passed",
        "credential_isolation": "not_run",
        "restart_persistence": "not_run"
      },
      "clean_quit": {
        "runtime_processes": {
          "status": "passed",
          "method": "Post-response process inspection found no process belonging to the disposable Codex fixture, managed wrapper, or adopted Engram provider.",
          "observed_count": 0
        },
        "database_holders": {
          "status": "passed",
          "method": "Post-response lsof inspection found no holder of either the disposable or production Engram database files.",
          "observed_count": 0
        },
        "client_leases": {
          "status": "passed",
          "method": "Post-response inspection found no entry in the disposable provider-client lease directory.",
          "observed_count": 0
        }
      },
      "runtime_support_claim": false,
      "disposition": "partial_real_host_evidence_not_promoted",
      "limitations": [
        "This observation proves one positive standalone-CLI signal case only; Codex remains manual and unconfigured.",
        "The wrapper's transient process exited before the operating-system cwd probe returned a path. Workspace provenance combines the Codex workdir, provider-returned cwd, exact wrapper source and hash, and pre-run resolver proof.",
        "No explicit credential canaries were injected, so the complete credential-isolation case remains unrun.",
        "The required negative, nested, linked-worktree, same-basename, multi-project, restart, instruction-lifecycle, Desktop, and other-platform cases remain unrun.",
        "No memory content was read or saved; memory read and write correctness were not tested.",
        "The PATH-alias warning affected refused helper creation under the disposable temporary Codex home, not execution of the exact absolute CLI binary."
      ],
      "source_refs": [
        {
          "repository_path": "docs/evidence/codex-0.145.0-darwin-arm64-dynamic-workspace-current-project-20260818.json",
          "sha256": "b40259018ed4417709adaea9f00a2f74ba8e43e89c4dbaec6a37ebbf87222c10"
        }
      ]
    },
    {
      "id": "codex-cli-0-145-0-reliability-20260818",
      "host_id": "codex",
      "execution_mode": "standalone_cli",
      "recorded_at": "2026-08-18T09:12:12+00:00",
      "executed_at": "2026-08-18T09:05:52+00:00",
      "platform": {
        "os": "macos",
        "os_version": "26.6.1",
        "os_build": "25G76",
        "architecture": "arm64"
      },
      "host_layers": [
        {
          "role": "standalone_engine",
          "name": "Codex CLI",
          "version": "0.145.0",
          "sha256": "1da3f4e0e96028b8a771814293c3033dafd1971f943f6c7e79b0897fe705f590"
        }
      ],
      "provider": {
        "name": "Engram",
        "version": "1.20.0",
        "sha256": "cbcb115278c332313d35c1500d261eadfc9ff74d400b021f06b3362b1df2d80a"
      },
      "toolkit": {
        "version": "0.1.0",
        "source_commit_context": "27eaa74d37d24e69ce4a1d009ae074da80de69ab",
        "source_tree_context": "e6d413640d0457cbc48bbcfadd8d31df39e92d62",
        "installed_wrapper_sha256": "7dfdcb94b582e658894664ba47ef6246c8b47d6eb65eb37e9a04872908921a07"
      },
      "project_resolution": {
        "expected_project": "naos-engram-memories",
        "returned_project": "naos-engram-memories",
        "provider_source": "process_override",
        "project_path_state": "empty",
        "incoming_project_signal": "absent",
        "workspace_signal": "process_cwd",
        "wrapper_resolution_source": "approved_git_remote",
        "workspace_kind": "synthetic_git_repository"
      },
      "checks": {
        "host_connected_mcp_server": "passed",
        "mem_current_project": "passed",
        "registered_canonical_project": "passed",
        "workspace_signal_provenance": "passed",
        "wrapper_resolution_provenance": "passed",
        "memory_read": "not_performed",
        "memory_save": "not_performed",
        "unregistered_project": "passed",
        "remote_mismatch": "not_run",
        "provider_unavailable": "passed",